{
  "schema": "quest@1.0",
  "id": "q.side.slime_hunt",
  "ver": 1,
  "category": "side",
  "title_key": "txt.quest.side.slime_hunt.title",
  "desc_key": "txt.quest.side.slime_hunt.desc",
  "tags": [
    "kill",
    "starter"
  ],
  "accept_condition": {
    "type": "flag.is_false",
    "params": {
      "key": "flg.quest.side.slime_hunt.completed"
    }
  },
  "complete_condition": {
    "type": "flag.int_compare",
    "params": {
      "key": "flg.kill.slime.count",
      "op": "gte",
      "value": 5
    }
  },
  "rewards": {
    "effects": [
      {
        "type": "gold.add",
        "target": {
          "entity_id": "pc.player"
        },
        "params": {
          "amount": 50
        }
      },
      {
        "type": "flag.set",
        "target": {
          "world": "global"
        },
        "params": {
          "key": "flg.quest.side.slime_hunt_completed",
          "value": true
        }
      }
    ],
    "reward_text_key": "txt.quest.side.slime_hunt.reward"
  }
}
